{
  "schema_version": "1",
  "backend": "tjs",
  "machine": { "host": "m1-max", "os": "macos", "cpu": "Apple M1 Max", "cpu_cores": 10, "cpu_threads": 10, "gpus": ["Apple M1 Max"] },
  "iters": 5,
  "spawns": 3,
  "runs": [
    {
      "provider": "CoreML",
      "device": "gpu",
      "model": "gemma4-E2B",
      "quant": "q4f16",
      "healthy": true,
      "vram_method": "unified",
      "tasks": [
        {
          "task": "summarize-small",
          "metrics": {
            "cold_start_ms": [150, 170],
            "model_load_ms": [55, 62],
            "context_init_ms": [12, 15],
            "warmup_ms": [3, 3],
            "ttft_ms": [45, 55],
            "decode_tps": [40, 38],
            "prefill_tps": null,
            "completion_ms": [300, 310]
          },
          "memory": {
            "prefill_rss_peak_mb": [800, 820],
            "prefill_vram_peak_mb": null,
            "decode_rss_peak_mb": [850, 870],
            "decode_vram_peak_mb": null,
            "decode_rss_sustained_mb": [830, 840],
            "decode_vram_sustained_mb": null
          },
          "sample_completions": ["The passage describes ..."]
        }
      ]
    },
    {
      "provider": "CoreML",
      "device": "gpu",
      "model": "qwen3-4B",
      "quant": "q4f16",
      "healthy": false,
      "unhealthy_reason": "brain-check decode mismatch",
      "vram_method": "unified",
      "tasks": []
    }
  ]
}
